<!ELEMENT students (students+)>
<!ELEMENT student(name,dod,major)>
<!ATTLIST student id ID #REQUá»ˆED>
<!ELEMENT name (#PCDATA)>
<!ELEMENT dod (#PCDATA)>
<!ELEMENT major (#PCDATA)>
